{"$schema":"http://json-schema.org/draft-07/schema#","title":"Ranking Policy v1","type":"object","additionalProperties":false,"required":["ranking_policy_version","default","capabilities","source_risk_reduction","confidence_evidence_strength","capability_overlap"],"properties":{"ranking_policy_version":{"const":"1.0.0"},"default":{"$ref":"#/definitions/capabilityPolicy"},"capabilities":{"type":"object","additionalProperties":{"$ref":"#/definitions/capabilityPolicy"}},"source_risk_reduction":{"type":"object","additionalProperties":false,"required":["observed_failure","structural_invariant","baseline_capability"],"properties":{"observed_failure":{"$ref":"#/definitions/ordinal"},"structural_invariant":{"$ref":"#/definitions/ordinal"},"baseline_capability":{"$ref":"#/definitions/ordinal"}}},"confidence_evidence_strength":{"type":"object","additionalProperties":false,"required":["low","medium","high"],"properties":{"low":{"$ref":"#/definitions/ordinal"},"medium":{"$ref":"#/definitions/ordinal"},"high":{"$ref":"#/definitions/ordinal"}}},"capability_overlap":{"type":"object","additionalProperties":{"$ref":"#/definitions/ordinal"}}},"definitions":{"ordinal":{"type":"integer","minimum":0,"maximum":3},"capabilityPolicy":{"type":"object","additionalProperties":false,"required":["invariant_criticality","regression_detection","silent_failure_exposure","execution_time","noise_risk","maintenance_cost"],"properties":{"invariant_criticality":{"$ref":"#/definitions/ordinal"},"regression_detection":{"$ref":"#/definitions/ordinal"},"silent_failure_exposure":{"$ref":"#/definitions/ordinal"},"execution_time":{"$ref":"#/definitions/ordinal"},"noise_risk":{"$ref":"#/definitions/ordinal"},"maintenance_cost":{"$ref":"#/definitions/ordinal"}}}}}
